tournament,eventName,player1,player2,player1_odds,player2_odds,eventdate,lastupdate
Promotions,ATP 2023 vs Season Specials,,,,,,
Promotions,Carlos Alcaraz Season 2023 Specials,,,,,,
Promotions,Holger Rune vs Season Specials 2023,,,,,,
Promotions,WTA 2023 vs Season Specials,,,,,,
Promotions,British Players vs Season Specials 2023,,,,,,
WTA,Ana Konjuh (CRO) vs Carole Monnet (FRA),Ana Konjuh (CRO),Carole Monnet (FRA),1.13,5.75,2022-11-30 19:45,2022-11-30 19:45
WTA,Tatjana Maria (GER) vs Victoria Jimenez Kasintseva (AND),Tatjana Maria (GER),Victoria Jimenez Kasintseva (AND),1.95,1.83,2022-11-30 20:15,2022-11-30 20:15
WTA,Weronika Falkowska (POL) vs Dayana Yastremska (UKR),Weronika Falkowska (POL),Dayana Yastremska (UKR),4.6,1.19,2022-12-01 09:00,2022-12-01 09:00
Challenger,Raphael Collignon (BEL) vs Riccardo Bonadio (ITA),Raphael Collignon (BEL),Riccardo Bonadio (ITA),1.75,1.95,2022-12-01 10:00,2022-12-01 10:00
Challenger,Maximilian Neuchrist (AUT) vs Timofey Skatov (KAZ),Maximilian Neuchrist (AUT),Timofey Skatov (KAZ),3.2,1.3,2022-12-01 10:00,2022-12-01 10:00
Challenger,Nerman Fatic (BIH) vs Jan Choinski (GBR),Nerman Fatic (BIH),Jan Choinski (GBR),2.05,1.7,2022-12-01 10:00,2022-12-01 10:00
Challenger,Inaki Cabrera Bello (ESP) vs Adrian Andreev (BUL),Inaki Cabrera Bello (ESP),Adrian Andreev (BUL),16.0,1.01,2022-12-01 10:00,2022-12-01 10:00
Challenger,Dusan Lajovic (SRB) vs Imanol Lopez Morillo (ESP),Dusan Lajovic (SRB),Imanol Lopez Morillo (ESP),1.14,5.0,2022-12-01 10:00,2022-12-01 10:00
Challenger,Michael Geerts (BEL) vs Oriol Roca Batalla (ESP),Michael Geerts (BEL),Oriol Roca Batalla (ESP),2.0,1.72,2022-12-01 10:00,2022-12-01 10:00
Challenger,Timo Stodder (GER) vs Vit Kopriva (CZE),Timo Stodder (GER),Vit Kopriva (CZE),2.6,1.44,2022-12-01 10:00,2022-12-01 10:00
ITF Men,Ilya Snitari (MDA) vs Kokoro Isomura (JPN),Ilya Snitari (MDA),Kokoro Isomura (JPN),1.33,2.95,2022-12-01 07:15,2022-12-01 07:15
ITF Men,Maxim Shin (UZB) vs Adam Moundir (MAR),Maxim Shin (UZB),Adam Moundir (MAR),3.1,1.3,2022-12-01 07:15,2022-12-01 07:15
ITF Men,Filip Cristian Jianu (ROU) vs Sarp Agabigun (TUR),Filip Cristian Jianu (ROU),Sarp Agabigun (TUR),1.11,5.25,2022-12-01 07:15,2022-12-01 07:15
ITF Men,Valerio Perruzza (ITA) vs Cezar Cretu (ROU),Valerio Perruzza (ITA),Cezar Cretu (ROU),6.0,1.08,2022-12-01 09:15,2022-12-01 09:15
ITF Men,Baran Soyler (TUR) vs Alex Marti Pujolras (ESP),Baran Soyler (TUR),Alex Marti Pujolras (ESP),7.25,1.05,2022-12-01 09:15,2022-12-01 09:15
ITF Men,Vasile Antonescu (ROU) vs Jorge Martinez Martinez (ESP),Vasile Antonescu (ROU),Jorge Martinez Martinez (ESP),3.9,1.2,2022-12-01 09:15,2022-12-01 09:15
ITF Men,Rrezart Cungu (MNE) vs Adrian Mateo Bejenaru (ROU),Rrezart Cungu (MNE),Adrian Mateo Bejenaru (ROU),1.05,7.25,2022-12-01 09:15,2022-12-01 09:15
ITF Men,E. Noskin/E. Philippov vs I. Beloborodko/M. Shin,E. Noskin/E. Philippov,I. Beloborodko/M. Shin,3.0,1.3,2022-12-01 11:15,2022-12-01 11:15
ITF Men,D. Amirov/S. Pogosian vs S. Agabigun/S. M. Ozdemir,D. Amirov/S. Pogosian,S. Agabigun/S. M. Ozdemir,6.0,1.07,2022-12-01 11:15,2022-12-01 11:15
ITF Men,Nick Hardt (DOM) vs Kenta Miyoshi (JPN),Nick Hardt (DOM),Kenta Miyoshi (JPN),1.05,7.25,2022-11-30 17:45,2022-11-30 17:45
ITF Men,Tauheed Browning (USA) vs Victor Lilov (USA),Tauheed Browning (USA),Victor Lilov (USA),4.33,1.17,2022-11-30 17:45,2022-11-30 17:45
ITF Men,Miguel Angel Cabrera (CHI) vs Guy Den Ouden (NED),Miguel Angel Cabrera (CHI),Guy Den Ouden (NED),8.0,1.04,2022-11-30 17:45,2022-11-30 17:45
ITF Men,J. Chin/M. Jones vs M. FostervsEstwick/J. A. Rodriguez Rodriguez,J. Chin/M. Jones,M. Foster-Estwick/J. A. Rodriguez Rodriguez,2.1,1.6,2022-11-30 19:45,2022-11-30 19:45
ITF Men,A. Jones/S. Liokossis vs J. Flores/J. Sheehy,A. Jones/S. Liokossis,J. Flores/J. Sheehy,6.75,1.05,2022-11-30 19:45,2022-11-30 19:45
ITF Men,Y. Jeong/T.vsW. Lee vs A. Binda/I. Simakin,Y. Jeong/T.-W. Lee,A. Binda/I. Simakin,1.36,2.75,2022-12-01 12:15,2022-12-01 12:15
ITF Men,Yeongseok Jeong (KOR) vs Kris Van Wyk (RSA),Yeongseok Jeong (KOR),Kris Van Wyk (RSA),2.15,1.6,2022-12-01 08:15,2022-12-01 08:15
ITF Men,Ilia Simakin (RUS) vs Saba Purtseladze (GEO),Ilia Simakin (RUS),Saba Purtseladze (GEO),2.2,1.57,2022-12-01 08:15,2022-12-01 08:15
ITF Men,Lukas Krainer (AUT) vs Maxim Zhukov (RUS),Lukas Krainer (AUT),Maxim Zhukov (RUS),1.16,4.4,2022-12-01 10:15,2022-12-01 10:15
ITF Men,Michal Mikula (POL) vs Vojtech Petr (CZE),Michal Mikula (POL),Vojtech Petr (CZE),1.16,4.4,2022-12-01 10:15,2022-12-01 10:15
ITF Men,Marcelo Zormann (BRA) vs Nicolas Zanellato (BRA),Marcelo Zormann (BRA),Nicolas Zanellato (BRA),1.62,2.1,2022-11-30 21:15,2022-11-30 21:15
ITF Men,I. Gimenez/G. Lomakin vs J. E. Schiessl/V. Tosetto,I. Gimenez/G. Lomakin,J. E. Schiessl/V. Tosetto,1.2,3.75,2022-11-30 19:15,2022-11-30 19:15
ITF Men,E. Bogo/H. J. Escurra Isnardi vs J. V. Couto Loureiro/G. Heide,E. Bogo/H. J. Escurra Isnardi,J. V. Couto Loureiro/G. Heide,5.75,1.08,2022-11-30 19:15,2022-11-30 19:15
ITF Men,R. Augusto dos Santos/N. Oliveira vs G. P. Tumasonis/F. Yamacita,R. Augusto dos Santos/N. Oliveira,G. P. Tumasonis/F. Yamacita,7.0,1.05,2022-11-30 19:15,2022-11-30 19:15
ITF Men,V. M. Alves/M. Cury Bueres vs P. Boscardin Dias/E. Ribeiro,V. M. Alves/M. Cury Bueres,P. Boscardin Dias/E. Ribeiro,6.0,1.07,2022-11-30 23:15,2022-11-30 23:15
ITF Men,T. Franco/F. Roncadelli vs L. Pinto/P. A. Saraiva Dos Santos,T. Franco/F. Roncadelli,L. Pinto/P. A. Saraiva Dos Santos,1.33,2.9,2022-11-30 23:15,2022-11-30 23:15
ITF Women,C. M. Mester/V. I. G. Popa Teiusanu vs A. Apalikhina/A. Kummel,C. M. Mester/V. I. G. Popa Teiusanu,A. Apalikhina/A. Kummel,1.25,3.3,2022-12-01 12:15,2022-12-01 12:15
ITF Women,Z. Rustemova/A. Sagandikova vs A. Fedorova/E. Masnaia,Z. Rustemova/A. Sagandikova,A. Fedorova/E. Masnaia,2.05,1.62,2022-12-01 14:15,2022-12-01 14:15
ITF Women,G. Carbonaro/M. Delai vs K. Sarkisova/E. Shalimova,G. Carbonaro/M. Delai,K. Sarkisova/E. Shalimova,2.75,1.36,2022-12-01 14:15,2022-12-01 14:15
ITF Women,V. Mikhaylova/E. Shebekina vs I.vsH. Cho/Y. T. Cho,V. Mikhaylova/E. Shebekina,I.-H. Cho/Y. T. Cho,5.0,1.11,2022-12-01 14:15,2022-12-01 14:15
ITF Women,Ilay Yoruk (TUR) vs Andrea Obradovic (SRB),Ilay Yoruk (TUR),Andrea Obradovic (SRB),1.6,2.15,2022-12-01 07:15,2022-12-01 07:15
ITF Women,Natalija Senic (SRB) vs Mayuka Aikawa (JPN),Natalija Senic (SRB),Mayuka Aikawa (JPN),1.83,1.83,2022-12-01 07:15,2022-12-01 07:15
ITF Women,Anastasia Safta (ROU) vs Madelief Hageman (NED),Anastasia Safta (ROU),Madelief Hageman (NED),1.28,3.25,2022-12-01 07:15,2022-12-01 07:15
ITF Women,Melis Ayda Uyar (TUR) vs Basak Eraydin (TUR),Melis Ayda Uyar (TUR),Basak Eraydin (TUR),3.9,1.2,2022-12-01 07:15,2022-12-01 07:15
ITF Women,Anna Ureke (RUS) vs Noka Juric (SLO),Anna Ureke (RUS),Noka Juric (SLO),1.25,3.5,2022-12-01 07:15,2022-12-01 07:15
ITF Women,Chiara Fornasieri (ITA) vs Valeriia Olianovskaia (RUS),Chiara Fornasieri (ITA),Valeriia Olianovskaia (RUS),6.75,1.06,2022-12-01 09:15,2022-12-01 09:15
ITF Women,A. Candiotto/R. Pereira vs J. Aney/M. F. Herazo Gonzalez,A. Candiotto/R. Pereira,J. Aney/M. F. Herazo Gonzalez,3.0,1.3,2022-11-30 19:15,2022-11-30 19:15
ITF Women,A. Anshba/V. Strakhova vs Y. CavallevsReimers/R. Vicens Mas,A. Anshba/V. Strakhova,Y. Cavalle-Reimers/R. Vicens Mas,1.72,1.91,2022-11-30 19:15,2022-11-30 19:15
ITF Women,M. Capurro Taborda/J. Riera vs I. Gamarra Martins/F. Jorge,M. Capurro Taborda/J. Riera,I. Gamarra Martins/F. Jorge,2.7,1.36,2022-11-30 21:15,2022-11-30 21:15
ITF Women,Aanya Goel (USA) vs Caroline Vernet (FRA),Aanya Goel (USA),Caroline Vernet (FRA),5.25,1.11,2022-11-30 17:45,2022-11-30 17:45
ITF Women,B. J. Fernandez/V. Hu vs E. Mazzoni/J. Mazzoni,B. J. Fernandez/V. Hu,E. Mazzoni/J. Mazzoni,1.05,6.75,2022-11-30 19:45,2022-11-30 19:45
ITF Women,L. Petruzelova/R. Schech vs N. Sengphrachanh/E. V. Poppel,L. Petruzelova/R. Schech,N. Sengphrachanh/E. V. Poppel,1.33,2.85,2022-11-30 19:45,2022-11-30 19:45
ITF Women,R. McAdoo/E. Ovcharenko vs K. Jokic/T. Ng,R. McAdoo/E. Ovcharenko,K. Jokic/T. Ng,2.05,1.62,2022-11-30 17:45,2022-11-30 17:45
ITF Women,Yi Tsen Cho (TPE) vs Ekaterina Shalimova (RUS),Yi Tsen Cho (TPE),Ekaterina Shalimova (RUS),3.75,1.22,2022-12-01 08:15,2022-12-01 08:15
ITF Women,IvsHsuan Cho (TPE) vs Yasmin Ezzat (EGY),I-Hsuan Cho (TPE),Yasmin Ezzat (EGY),1.83,1.83,2022-12-01 08:15,2022-12-01 08:15
ITF Women,Aglaya Fedorova (RUS) vs Nahia Berecoechea (FRA),Aglaya Fedorova (RUS),Nahia Berecoechea (FRA),3.25,1.28,2022-12-01 09:45,2022-12-01 09:45
ITF Women,Arina Solomatina (KGZ) vs Ayla Aksu (TUR),Arina Solomatina (KGZ),Ayla Aksu (TUR),6.75,1.06,2022-12-01 10:15,2022-12-01 10:15
ITF Women,Briana Szabo (ROU) vs Yujin Ahn (KOR),Briana Szabo (ROU),Yujin Ahn (KOR),2.2,1.57,2022-12-01 12:15,2022-12-01 12:15
ITF Women,Katarina Kuzmova (SVK) vs Maria Sara Popa (ROU),Katarina Kuzmova (SVK),Maria Sara Popa (ROU),1.3,3.1,2022-12-01 12:15,2022-12-01 12:15
Exhibitions,Justin Lyons (USA) vs Nicolas Acevedo (CHI),Justin Lyons (USA),Nicolas Acevedo (CHI),2.6,1.44,2022-11-30 18:45,2022-11-30 18:45
Exhibitions,William Bushamuka (USA) vs Peter Leber (HUN),William Bushamuka (USA),Peter Leber (HUN),1.44,2.6,2022-11-30 18:45,2022-11-30 18:45
Exhibitions,Amador Salazar (CHI) vs Mikel Anderson (USA),Amador Salazar (CHI),Mikel Anderson (USA),1.36,2.85,2022-11-30 20:45,2022-11-30 20:45
Exhibitions,Mika Berghaus (GER) vs Jackson Caldwell (USA),Mika Berghaus (GER),Jackson Caldwell (USA),1.53,2.35,2022-11-30 20:45,2022-11-30 20:45
Exhibitions,Rowland Phillips (JAM) vs Juan David Velasquez (COL),Rowland Phillips (JAM),Juan David Velasquez (COL),1.17,4.5,2022-11-30 20:45,2022-11-30 20:45
